Enter password: ****
Welcome to the MySQL monitor.  Commands end with ; or \g.
Your MySQL connection id is 147
Server version: 8.0.39 MySQL Community Server - GPL

Copyright (c) 2000, 2024, Oracle and/or its affiliates.

Oracle is a registered trademark of Oracle Corporation and/or its
affiliates. Other names may be trademarks of their respective
owners.

Type 'help;' or '\h' for help. Type '\c' to clear the current input statement.

mysql> show databases;
+--------------------+
| Database           |
+--------------------+
| information_schema |
| mysql              |
| performance_schema |
| sakila             |
| student            |
| sys                |
| user               |
| world              |
+--------------------+
8 rows in set (0.11 sec)

mysql> use student;
Database changed
mysql> select * from students;
+-----------+-----------+----------+------+------------------+----------------+
| studentID | firstname | lastname | age  | major            | enrollmentDate |
+-----------+-----------+----------+------+------------------+----------------+
|         1 | john      | deo      |   20 | computer science | 2022-09-01     |
|         2 | jane      | smith    |   22 | mathematics      | 2021-09-01     |
|         3 | alice     | johnson  |   19 | physics          | 2023-01-15     |
|         4 | bob       | williams |   23 | chemistry        | 2020-08-20     |
|         5 | charlie   | brown    |   21 | biology          | 2021-09-01     |
|         6 | david     | jones    |   24 | mathematics      | 2019-09-01     |
|         7 | eve       | davis    |   22 | computer science | 2022-01-10     |
+-----------+-----------+----------+------+------------------+----------------+
7 rows in set (0.01 sec)

mysql> update students set age = 22 where studentID = 1;
Query OK, 1 row affected (0.02 sec)
Rows matched: 1  Changed: 1  Warnings: 0

mysql> select * from students;
+-----------+-----------+----------+------+------------------+----------------+
| studentID | firstname | lastname | age  | major            | enrollmentDate |
+-----------+-----------+----------+------+------------------+----------------+
|         1 | john      | deo      |   22 | computer science | 2022-09-01     |
|         2 | jane      | smith    |   22 | mathematics      | 2021-09-01     |
|         3 | alice     | johnson  |   19 | physics          | 2023-01-15     |
|         4 | bob       | williams |   23 | chemistry        | 2020-08-20     |
|         5 | charlie   | brown    |   21 | biology          | 2021-09-01     |
|         6 | david     | jones    |   24 | mathematics      | 2019-09-01     |
|         7 | eve       | davis    |   22 | computer science | 2022-01-10     |
+-----------+-----------+----------+------+------------------+----------------+
7 rows in set (0.00 sec)

mysql> update students set major = data science where studentID = 1 and studentID = 7;
ERROR 1064 (42000): You have an error in your SQL syntax; check the manual that corresponds to your MySQL server version for the right syntax to use near 'science where studentID = 1 and studentID = 7' at line 1
mysql> update students set major = 'data science' where studentID = 1 and studentID = 7;
Query OK, 0 rows affected (0.00 sec)
Rows matched: 0  Changed: 0  Warnings: 0

mysql> select * from students;
+-----------+-----------+----------+------+------------------+----------------+
| studentID | firstname | lastname | age  | major            | enrollmentDate |
+-----------+-----------+----------+------+------------------+----------------+
|         1 | john      | deo      |   22 | computer science | 2022-09-01     |
|         2 | jane      | smith    |   22 | mathematics      | 2021-09-01     |
|         3 | alice     | johnson  |   19 | physics          | 2023-01-15     |
|         4 | bob       | williams |   23 | chemistry        | 2020-08-20     |
|         5 | charlie   | brown    |   21 | biology          | 2021-09-01     |
|         6 | david     | jones    |   24 | mathematics      | 2019-09-01     |
|         7 | eve       | davis    |   22 | computer science | 2022-01-10     |
+-----------+-----------+----------+------+------------------+----------------+
7 rows in set (0.00 sec)

mysql> update students set major = 'data science' where major = 'computer science';
Query OK, 2 rows affected (0.01 sec)
Rows matched: 2  Changed: 2  Warnings: 0

mysql> select * from students;
+-----------+-----------+----------+------+--------------+----------------+
| studentID | firstname | lastname | age  | major        | enrollmentDate |
+-----------+-----------+----------+------+--------------+----------------+
|         1 | john      | deo      |   22 | data science | 2022-09-01     |
|         2 | jane      | smith    |   22 | mathematics  | 2021-09-01     |
|         3 | alice     | johnson  |   19 | physics      | 2023-01-15     |
|         4 | bob       | williams |   23 | chemistry    | 2020-08-20     |
|         5 | charlie   | brown    |   21 | biology      | 2021-09-01     |
|         6 | david     | jones    |   24 | mathematics  | 2019-09-01     |
|         7 | eve       | davis    |   22 | data science | 2022-01-10     |
+-----------+-----------+----------+------+--------------+----------------+
7 rows in set (0.00 sec)

mysql> update students set age += 1 where major = 'data science';
ERROR 1064 (42000): You have an error in your SQL syntax; check the manual that corresponds to your MySQL server version for the right syntax to use near '+= 1 where major = 'data science'' at line 1
mysql> update students set age + 1 where major = 'data science';
ERROR 1064 (42000): You have an error in your SQL syntax; check the manual that corresponds to your MySQL server version for the right syntax to use near '+ 1 where major = 'data science'' at line 1
mysql> update students set age = age + 1 where major = 'data science';
Query OK, 2 rows affected (0.00 sec)
Rows matched: 2  Changed: 2  Warnings: 0

mysql> select * from students;
+-----------+-----------+----------+------+--------------+----------------+
| studentID | firstname | lastname | age  | major        | enrollmentDate |
+-----------+-----------+----------+------+--------------+----------------+
|         1 | john      | deo      |   23 | data science | 2022-09-01     |
|         2 | jane      | smith    |   22 | mathematics  | 2021-09-01     |
|         3 | alice     | johnson  |   19 | physics      | 2023-01-15     |
|         4 | bob       | williams |   23 | chemistry    | 2020-08-20     |
|         5 | charlie   | brown    |   21 | biology      | 2021-09-01     |
|         6 | david     | jones    |   24 | mathematics  | 2019-09-01     |
|         7 | eve       | davis    |   23 | data science | 2022-01-10     |
+-----------+-----------+----------+------+--------------+----------------+
7 rows in set (0.00 sec)

mysql> update students set firstname = 'sophia' and lastname = 'johnson' where studentID = 2;
ERROR 1292 (22007): Truncated incorrect DOUBLE value: 'sophia'
mysql> update students set firstname = 'sophia', lastname = 'johnson' where studentID = 2;
Query OK, 1 row affected (0.00 sec)
Rows matched: 1  Changed: 1  Warnings: 0

mysql> select * from students;
+-----------+-----------+----------+------+--------------+----------------+
| studentID | firstname | lastname | age  | major        | enrollmentDate |
+-----------+-----------+----------+------+--------------+----------------+
|         1 | john      | deo      |   23 | data science | 2022-09-01     |
|         2 | sophia    | johnson  |   22 | mathematics  | 2021-09-01     |
|         3 | alice     | johnson  |   19 | physics      | 2023-01-15     |
|         4 | bob       | williams |   23 | chemistry    | 2020-08-20     |
|         5 | charlie   | brown    |   21 | biology      | 2021-09-01     |
|         6 | david     | jones    |   24 | mathematics  | 2019-09-01     |
|         7 | eve       | davis    |   23 | data science | 2022-01-10     |
+-----------+-----------+----------+------+--------------+----------------+
7 rows in set (0.00 sec)

mysql> update students set major = 'physics' where enrollmentDate < '2022-01-01';
Query OK, 4 rows affected (0.00 sec)
Rows matched: 4  Changed: 4  Warnings: 0

mysql> select * from students;
+-----------+-----------+----------+------+--------------+----------------+
| studentID | firstname | lastname | age  | major        | enrollmentDate |
+-----------+-----------+----------+------+--------------+----------------+
|         1 | john      | deo      |   23 | data science | 2022-09-01     |
|         2 | sophia    | johnson  |   22 | physics      | 2021-09-01     |
|         3 | alice     | johnson  |   19 | physics      | 2023-01-15     |
|         4 | bob       | williams |   23 | physics      | 2020-08-20     |
|         5 | charlie   | brown    |   21 | physics      | 2021-09-01     |
|         6 | david     | jones    |   24 | physics      | 2019-09-01     |
|         7 | eve       | davis    |   23 | data science | 2022-01-10     |
+-----------+-----------+----------+------+--------------+----------------+
7 rows in set (0.00 sec)

mysql> update students set major = 'data science' where studentID = 2 or 5 or 6;
Query OK, 5 rows affected (0.01 sec)
Rows matched: 7  Changed: 5  Warnings: 0

mysql> select * from students;
+-----------+-----------+----------+------+--------------+----------------+
| studentID | firstname | lastname | age  | major        | enrollmentDate |
+-----------+-----------+----------+------+--------------+----------------+
|         1 | john      | deo      |   23 | data science | 2022-09-01     |
|         2 | sophia    | johnson  |   22 | data science | 2021-09-01     |
|         3 | alice     | johnson  |   19 | data science | 2023-01-15     |
|         4 | bob       | williams |   23 | data science | 2020-08-20     |
|         5 | charlie   | brown    |   21 | data science | 2021-09-01     |
|         6 | david     | jones    |   24 | data science | 2019-09-01     |
|         7 | eve       | davis    |   23 | data science | 2022-01-10     |
+-----------+-----------+----------+------+--------------+----------------+
7 rows in set (0.00 sec)

mysql> update students set major = 'physics' where studentID in (2, 3, 4, 5, 6);
Query OK, 5 rows affected (0.00 sec)
Rows matched: 5  Changed: 5  Warnings: 0

mysql> select * from students;
+-----------+-----------+----------+------+--------------+----------------+
| studentID | firstname | lastname | age  | major        | enrollmentDate |
+-----------+-----------+----------+------+--------------+----------------+
|         1 | john      | deo      |   23 | data science | 2022-09-01     |
|         2 | sophia    | johnson  |   22 | physics      | 2021-09-01     |
|         3 | alice     | johnson  |   19 | physics      | 2023-01-15     |
|         4 | bob       | williams |   23 | physics      | 2020-08-20     |
|         5 | charlie   | brown    |   21 | physics      | 2021-09-01     |
|         6 | david     | jones    |   24 | physics      | 2019-09-01     |
|         7 | eve       | davis    |   23 | data science | 2022-01-10     |
+-----------+-----------+----------+------+--------------+----------------+
7 rows in set (0.00 sec)

mysql> update students set major = 'data science' where studentId in (2, 5, 6);
Query OK, 3 rows affected (0.01 sec)
Rows matched: 3  Changed: 3  Warnings: 0

mysql> update students set major = 'mathematics' where studentID in (2, 6);
Query OK, 2 rows affected (0.00 sec)
Rows matched: 2  Changed: 2  Warnings: 0

mysql> select * from students;
+-----------+-----------+----------+------+--------------+----------------+
| studentID | firstname | lastname | age  | major        | enrollmentDate |
+-----------+-----------+----------+------+--------------+----------------+
|         1 | john      | deo      |   23 | data science | 2022-09-01     |
|         2 | sophia    | johnson  |   22 | mathematics  | 2021-09-01     |
|         3 | alice     | johnson  |   19 | physics      | 2023-01-15     |
|         4 | bob       | williams |   23 | physics      | 2020-08-20     |
|         5 | charlie   | brown    |   21 | data science | 2021-09-01     |
|         6 | david     | jones    |   24 | mathematics  | 2019-09-01     |
|         7 | eve       | davis    |   23 | data science | 2022-01-10     |
+-----------+-----------+----------+------+--------------+----------------+
7 rows in set (0.00 sec)

mysql> delete from students where studentID = 7;
Query OK, 1 row affected (0.01 sec)

mysql> select * from students;
+-----------+-----------+----------+------+--------------+----------------+
| studentID | firstname | lastname | age  | major        | enrollmentDate |
+-----------+-----------+----------+------+--------------+----------------+
|         1 | john      | deo      |   23 | data science | 2022-09-01     |
|         2 | sophia    | johnson  |   22 | mathematics  | 2021-09-01     |
|         3 | alice     | johnson  |   19 | physics      | 2023-01-15     |
|         4 | bob       | williams |   23 | physics      | 2020-08-20     |
|         5 | charlie   | brown    |   21 | data science | 2021-09-01     |
|         6 | david     | jones    |   24 | mathematics  | 2019-09-01     |
+-----------+-----------+----------+------+--------------+----------------+
6 rows in set (0.00 sec)

mysql> start transaction;
Query OK, 0 rows affected (0.00 sec)

mysql> delete from students where studentIDw = 6;
ERROR 1054 (42S22): Unknown column 'studentIDw' in 'where clause'
mysql> delete from students where studentID = 6;
Query OK, 1 row affected (0.00 sec)

mysql> select * from students;
+-----------+-----------+----------+------+--------------+----------------+
| studentID | firstname | lastname | age  | major        | enrollmentDate |
+-----------+-----------+----------+------+--------------+----------------+
|         1 | john      | deo      |   23 | data science | 2022-09-01     |
|         2 | sophia    | johnson  |   22 | mathematics  | 2021-09-01     |
|         3 | alice     | johnson  |   19 | physics      | 2023-01-15     |
|         4 | bob       | williams |   23 | physics      | 2020-08-20     |
|         5 | charlie   | brown    |   21 | data science | 2021-09-01     |
+-----------+-----------+----------+------+--------------+----------------+
5 rows in set (0.00 sec)

mysql> rollback;
Query OK, 0 rows affected (0.00 sec)

mysql> select * from students;
+-----------+-----------+----------+------+--------------+----------------+
| studentID | firstname | lastname | age  | major        | enrollmentDate |
+-----------+-----------+----------+------+--------------+----------------+
|         1 | john      | deo      |   23 | data science | 2022-09-01     |
|         2 | sophia    | johnson  |   22 | mathematics  | 2021-09-01     |
|         3 | alice     | johnson  |   19 | physics      | 2023-01-15     |
|         4 | bob       | williams |   23 | physics      | 2020-08-20     |
|         5 | charlie   | brown    |   21 | data science | 2021-09-01     |
|         6 | david     | jones    |   24 | mathematics  | 2019-09-01     |
+-----------+-----------+----------+------+--------------+----------------+
6 rows in set (0.00 sec)

mysql> delete from students where studentID = 6;
Query OK, 1 row affected (0.00 sec)

mysql> select * from students;
+-----------+-----------+----------+------+--------------+----------------+
| studentID | firstname | lastname | age  | major        | enrollmentDate |
+-----------+-----------+----------+------+--------------+----------------+
|         1 | john      | deo      |   23 | data science | 2022-09-01     |
|         2 | sophia    | johnson  |   22 | mathematics  | 2021-09-01     |
|         3 | alice     | johnson  |   19 | physics      | 2023-01-15     |
|         4 | bob       | williams |   23 | physics      | 2020-08-20     |
|         5 | charlie   | brown    |   21 | data science | 2021-09-01     |
+-----------+-----------+----------+------+--------------+----------------+
5 rows in set (0.00 sec)

mysql> delete from students where major = 'data science';
Query OK, 2 rows affected (0.01 sec)

mysql> select * from students;
+-----------+-----------+----------+------+-------------+----------------+
| studentID | firstname | lastname | age  | major       | enrollmentDate |
+-----------+-----------+----------+------+-------------+----------------+
|         2 | sophia    | johnson  |   22 | mathematics | 2021-09-01     |
|         3 | alice     | johnson  |   19 | physics     | 2023-01-15     |
|         4 | bob       | williams |   23 | physics     | 2020-08-20     |
+-----------+-----------+----------+------+-------------+----------------+
3 rows in set (0.00 sec)

mysql> delete from students where enrollmentDate <= '2022-01-01';
Query OK, 2 rows affected (0.01 sec)

mysql> select * from students;
+-----------+-----------+----------+------+---------+----------------+
| studentID | firstname | lastname | age  | major   | enrollmentDate |
+-----------+-----------+----------+------+---------+----------------+
|         3 | alice     | johnson  |   19 | physics | 2023-01-15     |
+-----------+-----------+----------+------+---------+----------------+
1 row in set (0.00 sec)

mysql>